mysql> select*from employee;
+------+--------+------------+-------------------+------------------+------------+
| SSN  | name   | department | project_name      | project_location | salary     |
+------+--------+------------+-------------------+------------------+------------+
| 1112 | Helen  | MCA        | auto atlas        | calicut          | 8659889.00 |
| 112B | Haein  | MCA        | MedRep            | kochi            |   86589.10 |
| 113F | dongli | Bsc        | smart villa       | kannur           |   24367.00 |
| 165F | alen   | trading    | sales             | Hyderabad        |   24977.00 |
| 1234 | Gopi   | HR         | medical system    | chennai          |   24977.00 |
| 1434 | lubna  | HR         | management        | Delhi            |   24977.89 |
| 14KL | anita  | production | market control    | Mumbai           |    2476.90 |
| 156L | daisy  | finance    | vehicle control   | goa              |    2476.90 |
| 153K | remo   | finance    | system management | kasargod         |    5676.09 |
| 198W | jimny  | marketing  | system control    | kollam           |    5676.88 |
+------+--------+------------+-------------------+------------------+------------+
10 rows in set (0.00 sec)

mysql> select min(salary)from employee;
+-------------+
| min(salary) |
+-------------+
|     2476.90 |
+-------------+
1 row in set (0.00 sec)

mysql> select max(salary)from employee;
+-------------+
| max(salary) |
+-------------+
|  8659889.00 |
+-------------+
1 row in set (0.00 sec)

mysql> select avg(salary)from employee;
+---------------+
| avg(salary)   |
+---------------+
| 886208.376172 |
+---------------+
1 row in set (0.00 sec)

mysql> select salary from employee where salary between 10000 and 40000;
+----------+
| salary   |
+----------+
| 24367.00 |
| 24977.00 |
| 24977.00 |
| 24977.89 |
+----------+
4 rows in set (0.02 sec)

mysql> select department from employee where department in('HR','production','finance');
+------------+
| department |
+------------+
| HR         |
| HR         |
| production |
| finance    |
| finance    |
+------------+
5 rows in set (0.04 sec)

mysql> select*from employee where department in('HR','production','finance');
+------+-------+------------+-------------------+------------------+----------+
| SSN  | name  | department | project_name      | project_location | salary   |
+------+-------+------------+-------------------+------------------+----------+
| 1234 | Gopi  | HR         | medical system    | chennai          | 24977.00 |
| 1434 | lubna | HR         | management        | Delhi            | 24977.89 |
| 14KL | anita | production | market control    | Mumbai           |  2476.90 |
| 156L | daisy | finance    | vehicle control   | goa              |  2476.90 |
| 153K | remo  | finance    | system management | kasargod         |  5676.09 |
+------+-------+------------+-------------------+------------------+----------+
5 rows in set (0.00 sec)

mysql> select department from employee where department not in('HR','production','finance');
+------------+
| department |
+------------+
| MCA        |
| MCA        |
| Bsc        |
| trading    |
| marketing  |
+------------+
5 rows in set (0.00 sec)

mysql> select count(department) from employee where department group by department;
Empty set, 8 warnings (0.06 sec)

mysql> select count(department) from employee group by department;
+-------------------+
| count(department) |
+-------------------+
|                 2 |
|                 1 |
|                 1 |
|                 2 |
|                 1 |
|                 2 |
|                 1 |
+-------------------+
7 rows in set (0.00 sec)

mysql> select count(department) from employee order by department;
+-------------------+
| count(department) |
+-------------------+
|                10 |
+-------------------+
1 row in set (0.00 sec)

mysql>  alter table employee add primary key(SSN);
Query OK, 0 rows affected (1.73 sec)
Records: 0  Duplicates: 0  Warnings: 0

mysql> desc employee;
+------------------+-------------+------+-----+---------+-------+
| Field            | Type        | Null | Key | Default | Extra |
+------------------+-------------+------+-----+---------+-------+
| SSN              | varchar(10) | NO   | PRI | NULL    |       |
| name             | varchar(20) | YES  |     | NULL    |       |
| department       | varchar(20) | YES  |     | NULL    |       |
| project_name     | varchar(30) | YES  |     | NULL    |       |
| project_location | varchar(20) | YES  |     | NULL    |       |
| salary           | float(10,2) | YES  |     | NULL    |       |
+------------------+-------------+------+-----+---------+-------+
6 rows in set (0.17 sec)

mysql> alter table employee drop primay key;

Query OK, 10 rows affected (0.87 sec)
Records: 10  Duplicates: 0  Warnings: 0

mysql> desc employee;
+------------------+-------------+------+-----+---------+-------+
| Field            | Type        | Null | Key | Default | Extra |
+------------------+-------------+------+-----+---------+-------+
| SSN              | varchar(10) | NO   |     | NULL    |       |
| name             | varchar(20) | YES  |     | NULL    |       |
| department       | varchar(20) | YES  |     | NULL    |       |
| project_name     | varchar(30) | YES  |     | NULL    |       |
| project_location | varchar(20) | YES  |     | NULL    |       |
| salary           | float(10,2) | YES  |     | NULL    |       |
+------------------+-------------+------+-----+---------+-------+
6 rows in set (0.00 sec)

mysql>mysql> alter table orders add primary key(order_id);
Query OK, 0 rows affected (1.45 sec)
Records: 0  Duplicates: 0  Warnings: 0



mysql> alter table product add primary key(pro_id);
Query OK, 0 rows affected (0.98 sec)
Records: 0  Duplicates: 0  Warnings: 0

mysql> desc product;
+----------+-------------+------+-----+---------+-------+
| Field    | Type        | Null | Key | Default | Extra |
+----------+-------------+------+-----+---------+-------+
| pro_id   | varchar(10) | NO   | PRI | NULL    |       |
| pro_name | varchar(20) | YES  |     | NULL    |       |
| order_id | varchar(10) | YES  |     | NULL    |       |
+----------+-------------+------+-----+---------+-------+
3 rows in set (0.00 sec)




mysql> desc orders;
+---------------+-------------+------+-----+---------+-------+
| Field         | Type        | Null | Key | Default | Extra |
+---------------+-------------+------+-----+---------+-------+
| order_id      | varchar(10) | NO   | PRI | NULL    |       |
| customer_id   | varchar(10) | YES  |     | NULL    |       |
| customer_name | varchar(20) | YES  |     | NULL    |       |
| order_date    | date        | YES  |     | NULL    |       |
+---------------+-------------+------+-----+---------+-------+
4 rows in set (0.00 sec)

mysql> alter table product add foreign key(order_id) references orders(order_id);
ERROR 1452 (23000): Cannot add or update a child row: a foreign key constraint fails (`sample`.`#sql-147c_b`, CONSTRAINT `product_ibfk_1` FOREIGN KEY (`order_id`) REFERENCES `orders` (`order_id`))
mysql> select*from orders;
+----------+-------------+---------------+------------+
| order_id | customer_id | customer_name | order_date |
+----------+-------------+---------------+------------+
| 101      | 10G         | dolu          | 2022-11-30 |
| 102      | 10B         | aifa          | 2023-07-24 |
| 103      | 10C         | alan          | 2023-09-20 |
| 104      | 10D         | alan          | 2024-03-23 |
| 105      | 10E         | sofia         | 2024-10-26 |
+----------+-------------+---------------+------------+
5 rows in set (0.01 sec)

mysql> select*from product;
+--------+----------+----------+
| pro_id | pro_name | order_id |
+--------+----------+----------+
| 1      | keyboard | 102      |
| 2      | PS4      | 103      |
| 3      | bicycle  | 104      |
| 4      | mouse    | 105      |
| 5      | pen      | 106      |
+--------+----------+----------+
5 rows in set (0.00 sec)

mysql> alter table product add foreign key(order_id) references orders(order_id);
ERROR 1452 (23000): Cannot add or update a child row: a foreign key constraint fails (`sample`.`#sql-147c_b`, CONSTRAINT `product_ibfk_1` FOREIGN KEY (`order_id`) REFERENCES `orders` (`order_id`))
mysql> select orders.order_id,orders.customer_id,orders.customer_name,orders.order_date,product.pro_id,product.pro_name,product.order_id from orders join product on orders.order_id=product.order_id;
+----------+-------------+---------------+------------+--------+----------+----------+
| order_id | customer_id | customer_name | order_date | pro_id | pro_name | order_id |
+----------+-------------+---------------+------------+--------+----------+----------+
| 102      | 10B         | aifa          | 2023-07-24 | 1      | keyboard | 102      |
| 103      | 10C         | alan          | 2023-09-20 | 2      | PS4      | 103      |
| 104      | 10D         | alan          | 2024-03-23 | 3      | bicycle  | 104      |
| 105      | 10E         | sofia         | 2024-10-26 | 4      | mouse    | 105      |
+----------+-------------+---------------+------------+--------+----------+----------+
4 rows in set (0.02 sec)



mysql> delete from product where order_id='106';
Query OK, 1 row affected (0.11 sec)

mysql> alter table product add foreign key(order_id) references orders(order_id);
Query OK, 4 rows affected (1.62 sec)
Records: 4  Duplicates: 0  Warnings: 0

mysql> desc product;
+----------+-------------+------+-----+---------+-------+
| Field    | Type        | Null | Key | Default | Extra |
+----------+-------------+------+-----+---------+-------+
| pro_id   | varchar(10) | NO   | PRI | NULL    |       |
| pro_name | varchar(20) | YES  |     | NULL    |       |
| order_id | varchar(10) | YES  | MUL | NULL    |       |
+----------+-------------+------+-----+---------+-------+
3 rows in set (0.04 sec)

mysql> create view employeeview as select name,department from employee;
Query OK, 0 rows affected (0.14 sec)

mysql> select*from employeeview;
+--------+------------+
| name   | department |
+--------+------------+
| Helen  | MCA        |
| Haein  | MCA        |
| dongli | Bsc        |
| Gopi   | HR         |
| lubna  | HR         |
| anita  | production |
| remo   | finance    |
| daisy  | finance    |
| alen   | trading    |
| jimny  | marketing  |
+--------+------------+
10 rows in set (0.09 sec)








